{
  "contract_version": "1.0.0",
  "lanes": {
    "sol": { "class": "judgment", "reasoning": "high" },
    "terra": { "class": "implementation", "reasoning": "medium" },
    "luna": { "class": "bounded-retrieval", "reasoning": "low" }
  },
  "roles": {
    "executor": { "lane": "terra", "provenance": "user-approved" }
  },
  "targets": {
    "claude": {
      "lanes": {
        "sol": {
          "model": "claude-opus",
          "provenance": "user-local"
        }
      }
    }
  }
}
